{
  "name": "webdev-agent-kit",
  "version": "1.6.0",
  "license": "Apache-2.0",
  "description": "Internal source and distribution inventory for the WebDev Agent Kit skill bundle.",
  "portable_core": "common/core/runtime-core-policy.md",
  "default_profile": "react-typescript",
  "profiles": {
    "react-typescript": "profiles/react-typescript/PROFILE.md"
  },
  "adapters": {
    "claude-code": "adapters/claude-code.md",
    "codex": "adapters/codex.md",
    "cursor": "adapters/cursor.md"
  },
  "skills": [
    "agent-rules-skill-author",
    "agent-self-improvement",
    "design-screenshot-spec",
    "execution-plan-manager",
    "frontend-architecture-planner",
    "frontend-bugfix-debugger",
    "frontend-design-director",
    "frontend-design-intelligence",
    "frontend-layout-implementer",
    "frontend-linter-manager",
    "frontend-prototype-explorer",
    "frontend-quality-reviewer",
    "frontend-refactor-surgeon",
    "frontend-visual-qa",
    "goal-planner",
    "greenfield-project-builder",
    "loop-workflow-planner",
    "mcp-toolchain-manager",
    "pattern-library-manager",
    "project-context-adapter",
    "project-onboarding-adapter",
    "webdev-kit-updater"
  ],
  "targets": {
    "claude-code": {
      "kind": "plugin",
      "output": "dist/claude-code",
      "install_mode": "plugin-install",
      "entrypoint": ".claude-plugin/plugin.json",
      "skills_root": "skills",
      "validator": "scripts/validate_claude_plugin_target.py"
    },
    "codex": {
      "kind": "project-bundle",
      "output": "dist/codex",
      "install_mode": "project-root-extract",
      "entrypoint": ".agents/AGENTS.md",
      "skills_root": ".agents/skills",
      "validator": "scripts/validate_codex_project_target.py"
    },
    "cursor": {
      "kind": "project-bundle",
      "output": "dist/cursor",
      "install_mode": "project-root-extract",
      "entrypoint": ".cursor/rules/webdev-agent-kit.mdc",
      "skills_root": ".agents/skills",
      "validator": "scripts/validate_cursor_target.py"
    }
  },
  "target_aliases": {
    "claude": "claude-code",
    "vs-code-claude": "claude-code",
    "vs-code-codex": "codex"
  },
  "excludes": [
    "project/**",
    "dist/**",
    "docs/**",
    ".obsidian/**"
  ],
  "claude_agents": [
    "wdk-architect",
    "wdk-architect-deep",
    "wdk-complex",
    "wdk-lookup",
    "wdk-reviewer",
    "wdk-reviewer-deep",
    "wdk-reviewer-light",
    "wdk-worker",
    "wdk-worker-light"
  ]
}
